{"channel":"stable","highest_sequence":1,"issued_at_unix_secs":1800000000,"manifest_digest":"c3f4abaf3ffffa45085e1e9404743b840c931360821ff5161149af4b74338669","schema_version":1,"state_model_sha256":"e7098bff0fdcf898ea4d075c8d4f349695f4058749e1d7b0217eb47e7ed02c00","trusted_time_unix_secs":1800000000}